{
  "obstruction_id": "p1/obs-1",
  "kind": "missing-lemma",
  "formal_run_id": "p1/fr-2",
  "formal_state_ids": ["p1/fs-4", "p1/fs-5"],
  "minimal_state_artifact": "sha256:4c4c4c4c4c4c4c4c4c4c4c4c4c4c4c4c4c4c4c4c4c4c4c4c4c4c4c4c4c4c4c4c",
  "diagnostic_artifacts": [
    "sha256:2a2a2a2a2a2a2a2a2a2a2a2a2a2a2a2a2a2a2a2a2a2a2a2a2a2a2a2a2a2a2a2a"
  ],
  "repeated_failure_family": "apply-failure-no-matching-conclusion",
  "premises_considered": ["Nat.add_comm", "Nat.le_antisymm"],
  "tactic_families_considered": ["apply", "rw", "simp"],
  "evidence": [
    {
      "kind": "model-score",
      "artifact_hash": "sha256:e5e5e5e5e5e5e5e5e5e5e5e5e5e5e5e5e5e5e5e5e5e5e5e5e5e5e5e5e5e5e5e5",
      "note": "no candidate lemma scored above threshold across 3 policies"
    }
  ],
  "suggested_escalation": "bridge-lemma",
  "environment_hash": "sha256:c3c3c3c3c3c3c3c3c3c3c3c3c3c3c3c3c3c3c3c3c3c3c3c3c3c3c3c3c3c3c3c3"
}
